title,rating,username,description,date,image_urls,asin_number
The GOAT.,5.0 out of 5 stars,marc torres,"I will never buy another brand of Motor Oil other than Royal Purple.
I have 2019 Lexus es350 Fsport and decided to change the type of oil I had been using which was oem Lexus/Toyota Motor oil, which is actually Mobil. Its suggested to go to a high mileage oil at 80K miles so I went with Royal Purple. Even though this grade is not available for specific High mileage which is oem spec sae ow20. So I decided to spend the extra $ on this oil along with the K&N oil filter. I read a review that this oil improved their cars performance at the 2nd oil change. Well I made the change at 80K miles  and drove to FL from NY which was over a thousand miles each way.
And on the way back to NY after  and just over 2K miles of driving, My cars performance has been outstanding
 More importantly,.consistently performing better. And now I have gotten the 2nd oil change with this Royal Purple and will never buy another Motor Oil other than This one. I really didn't expect to feel a difference in performance due to a specific Motor Oil. But Royal Purple has proven otherwise. And the reason for the high miles on my csr is cause Im an Uber driver in NY and will be an Uber driver in Miami. This product performed to all the hype.","Reviewed in the United States on June 17, 2023",,
Best there is,5.0 out of 5 stars,C. Clark,I have watched several YT videos with individual testers and this or Amsoil always comes in #1. With the price equivalent with everything else I just buy the best. I have 2 new model year 2022 vehicles I'm not gonna compromise,"Reviewed in the United States on July 27, 2023",,
Great oils and Filters,5.0 out of 5 stars,Tio,Been using this product for several years now along with there oil filters. Very satisfied with there Quality and value!!,"Reviewed in the United States on July 31, 2023",,
Best oil on the market,5.0 out of 5 stars,Sidney,While using this product all my vehicles have seen an increase I fuel economy.,"Reviewed in the United States on August 5, 2023",,
Great price for this product,5.0 out of 5 stars,Justin Smith,Difficult to find quality high performance oil in this weight… especially for this price,"Reviewed in the United States on July 1, 2023",,
GREAT PRODUCT,5.0 out of 5 stars,K F,Fast delivery. Product as described and great price!,"Reviewed in the United States on June 26, 2023",,
Excellent product,5.0 out of 5 stars,SITN,Use it in all my vehicles.,"Reviewed in the United States on June 9, 2023",,
Worth every cent,5.0 out of 5 stars,Casey Berwald,"Switched over to purple after 100k after giving in to people who swear by it. Cleaned it up and really made a difference, engine ran smoother and quieter and by the 2nd oil change with purple it was a whole new car. Its the only oil we use now in all our cars and equipment.","Reviewed in the United States on March 20, 2023",,
Great oil!,5.0 out of 5 stars,fdgbg,"I have been using royal purple oil in my vehicles for 4-5 years now. Have never been disappointed! I can usually go about 12,000 miles between oil changes","Reviewed in the United States on April 19, 2023",,
Great product!,5.0 out of 5 stars,JOSEY WALES,This is high quality oil fora good price.,"Reviewed in the United States on May 4, 2023",,
