title,rating,username,description,date,image_urls,asin_number
"The same, but for more money",3.0 out of 5 stars,Marcus Allman,To me it seemed essentially the same as regular old mobile one synthetic.,"Reviewed in the United States on November 12, 2016",,
Three Stars,3.0 out of 5 stars,cdb4,good price,"Reviewed in the United States on March 8, 2018",,
First time,1.0 out of 5 stars,Alasgar Zada,first time I saw this kind of label. I don't now this original oil,"Reviewed in the United States on February 10, 2021",https://images-na.ssl-images-amazon.com/images/I/A15XwttZL3L._SY88.jpg,
Great if you are looking to have 2 quarts of Mobil 1 oil on your driveway!,1.0 out of 5 stars,Todd Sheffer,I purchased 3 containers of Mobil 1 oil and I was hoping to use it in a car however approximately 2 quarts were spilled on my driveway. I can't figure out how to get it off of my driveway and into my car so I guess it wasn't a good deal after all.,"Reviewed in the United States on February 12, 2016",,
I order 4 Gallon I got only 2 gallon they charge me for 4,1.0 out of 5 stars,Ferman Ahmed,,"Reviewed in the United States on August 31, 2021",https://m.media-amazon.com/images/I/B1Lj-Z2YcCS._SY88.jpg,
Idiotic!,1.0 out of 5 stars,Kindle Customer,Who puts three 5 gallon oil bottles into a single flimsy box!??? This was dumped in pieces on my doorstep. I feel lucky the oil bottles didnt leak! Idiotic!,"Reviewed in the United States on April 11, 2018",https://images-na.ssl-images-amazon.com/images/I/81wzenh692L._SY88.jpg,
Que seA original,1.0 out of 5 stars,Jorge nunez,No es original,"Reviewed in the United States on April 22, 2021",,
"Amazon, why are you selling outdated oil?",1.0 out of 5 stars,Mort,"This has a API rating of SL.  That was approved in 2001.  Come on, that was out dated in 2004 with the introduction of the SM rating.  I thought Amazon would move enough product to sell oil with a current rating.","Reviewed in the United States on November 9, 2015",,
Caution got Shortchanged!,1.0 out of 5 stars,Sasafracas,"Just received order, ordered 6 received 4, loosely in xl box with 2 oil filters ( paper inserts) oil jugs could have crushed filters.","Reviewed in the United States on March 25, 2019",,
WRONG KIND OF OIL,1.0 out of 5 stars,The Young cable,"I ordered the 0W-40 full synthetic Mobil 1.  I received the 10W-30 high mileage synthetic oil, which is totally not the same oil.  One star is too generous already.","Reviewed in the United States on March 16, 2018",,
Not the same as pictured,1.0 out of 5 stars,Jmini,Purchased two bottles but they were different from the one that was pictured did not say for Honda and Toyota. Going to return them and get them at Walmart. Great oil I use it in all my vehicles.,"Reviewed in the United States on March 18, 2017",,
Also bought it in town for 7.00 less each.,1.0 out of 5 stars,jeffrey combs,"Product is awesome, I use it in all of my cars. . Cancelled the order. But a few days later, the oil came anyway.","Reviewed in the United States on September 8, 2018",,
Great oil,5.0 out of 5 stars,Tyler Scott McHenry,Oil is great for your car. Great price as well compared to store,"Reviewed in the United States on July 31, 2023",,
It’s oil,5.0 out of 5 stars,Jonathan H.,"It’s oil, it works, I have used this for years with no issues.","Reviewed in the United States on July 31, 2023",,
Can't hear my car running,5.0 out of 5 stars,Panagiotis,"I have been using this since my very first oil change in 2010 with my brand new Nissan Altima 3.5SR. I change the oil, with the Mobil1 filter, every 6 months or roughly 5k miles. The car gets the same gas mileage it did on day one and you can't hear it when it's running (unless it's freezing and I just started it of ocurse). My car has 145k miles and it just keeps going!","Reviewed in the United States on June 17, 2023",,
Works great on my car,5.0 out of 5 stars,Rock Siler-Wurst,Love this product.  Use every 20k or yearly on my 07 accord,"Reviewed in the United States on July 24, 2023",,
Great product,5.0 out of 5 stars,Rich,Mobile 1 is a great product. It keeps my car running smoothly 👍🏻,"Reviewed in the United States on July 26, 2023",,
Best oil available,5.0 out of 5 stars,Beldar,I have always bought this but until recently only available at big box store. Thanks Amazon,"Reviewed in the United States on July 21, 2023",,
Excellent Oil,5.0 out of 5 stars,Ronald Alexander,Excellent oil at a great price.,"Reviewed in the United States on August 1, 2023",,
Its oil,5.0 out of 5 stars,AJ,Not much to say it works,"Reviewed in the United States on July 27, 2023",,
It's oil,5.0 out of 5 stars,boomer,Engine,"Reviewed in the United States on August 10, 2023",,
Cheaper than Orielly's,5.0 out of 5 stars,michael baugh,Good price.,"Reviewed in the United States on July 28, 2023",,
The best product,4.0 out of 5 stars,Stan the Man,Use on my old car And makes it run better,"Reviewed in the United States on September 3, 2022",,
Average Cost,4.0 out of 5 stars,Martha Mulnix,"You'll pay about the same here as you would anywhere else, but not poor quality. You just have to wait for it to arrive instead of getting it the same day.","Reviewed in the United States on April 28, 2022",,
Highly recommend,4.0 out of 5 stars,DC,We own many vehicles - have used Mobil 1 full synthetic for years & it has served us well. I drive about three times the “average” and my husband drives 375 miles/week for work. This costs more but we feel it’s worth it (and my husband is a certified mechanic).,"Reviewed in the United States on March 3, 2022",,
No estoy del todo satisfecho por lo explicado en la reseña escrita,4.0 out of 5 stars,Jorge Rodriguez,"Este producto que me llego no es exactamente el que esta en la imagen de Amazon que dice 10000 millas garantizadas, vino en otro pomo de coloración azul el cual no especifica las millas que puede usarse, por favor distribuir exactamente el producto que se muestra en la imagen de Amazon y no supuestos equivalentes","Reviewed in the United States on February 1, 2022",https://m.media-amazon.com/images/I/71RiSo8DZPL._SY88.jpg,
Good oil,4.0 out of 5 stars,Ross C. Thoms,"No mileage improvement, but Mobil One is a quality oil and I don't expect problems","Reviewed in the United States on July 16, 2022",,
Looking for a better quality.,4.0 out of 5 stars,Alex G.,"I purchased the mobil 1 extended performances motor oil to replace the oil in my 2016 Altima and 2015 Subaru Forester. The one i previously used was the regular 0W-20 for 10k miles. I can't really tell the difference in performance at the moment, everything runs the same. Will keep an eye on it periodically to see if there are any changes in color and level. The oil I had in my cars previously was the same level after 10k miles,  will see how this one performs.","Reviewed in the United States on September 1, 2021",https://m.media-amazon.com/images/I/812Xz6qE3GL._SY88.jpg,
Being Picky I guess.,4.0 out of 5 stars,Siddigger,"Do not know what is going on here. I have 3 5 quart. I always shake mine to make sure I get all the additives. That's where I noticed a difference. This one I just got is just like water and my others are noticely thicker. It is 45 degrees so easier to tell. This is like 0w-30 not 5w-30 when shaking. Do not know if it is poor quality control by Mobil, improvement or what. Been using Mobil after switching from Amsoil hype for years and happy. No big deal I suppose but sending it back. FYI, this the only 100% Syn by VOLUME that Mobile makes I think. Over 17% Syn and you can call it 100% syn oil by Feds. The 17% is 100% as they say. Mobile One I think is a blend and that's why I also use that in another vehicle. See how this goes and might go back to Mobile One blend. I also use Schaeffer oil advailable on Amazon I think, in my Harley and very very impressed.","Reviewed in the United States on October 26, 2017",,
Reliable transmission protection and engine performance,4.0 out of 5 stars,Jeremy K. Stoltzfus,"I've been using Mobile 1 synthetic oil and filters on a used vehicle for over 10 yrs and 150,000 miles. I've had no transmission or severe engine performance issues yet. Any auto issue was a result of outside influence and not related to the performance of the automobile parts/functions impacted by the application of Mobile 1 engine oils or oil filters. As an automobile operator I would recommend Mobile One oil and filters for most standard or high mileage automobile owners and operators based on a 10,000 - 20,000 mile per year non-hauling usage.","Reviewed in the United States on February 21, 2021",,
Seems to be like any quality oil.,4.0 out of 5 stars,Greener,Seems to be like any quality oil.,"Reviewed in the United States on September 16, 2022",,
"Reasonable Price, so keep to 5K miles interval",4.0 out of 5 stars,J. Brown,"Reasonable Price, so can Keep to a schedule of oil changes at reasonable mileage intervals of every 5k or so (15k is rather extreme).","Reviewed in the United States on April 4, 2022",,
The picture on the bottle looks like it has a 2 in front of the Dexos ...,3.0 out of 5 stars,Marty/Sue,Oil took longer to receive than expected. The picture on the bottle looks like it has a 2 in front of the Dexos logo but it is a 1 with a little symbol that make it look like a 2. Luckily I have one vehicle that can use Dexos1 but I thought I was getting Dexos 2  which my other vehicle requires.,"Reviewed in the United States on April 18, 2017",,
I don't get any lifter noise though and it starts easy in the winter,3.0 out of 5 stars,Joe,"It's ok, I'm running it in my Miata and the VVT sticks a bit in it. I don't get any lifter noise though and it starts easy in the winter.
Will be switching to Shell Rotella T6 which I run in the bike (as it's higher detergent). Good for the price though.","Reviewed in the United States on February 19, 2018",,
To much,3.0 out of 5 stars,Troy weber,Save your money 💰,"Reviewed in the United States on August 25, 2021",,
Was a great price several months ago,3.0 out of 5 stars,Jenny G.,"Was a great price several months ago.  Now I'm ready to buy again and price has almost doubled.  I can get it much cheaper from Walmart or Ebay and even my local auto parts stores.  Too bad, was a great way to get a great oil and a good price.","Reviewed in the United States on February 4, 2017",,
Doesn last 15k as said,3.0 out of 5 stars,Gary V.,"Good oil I think... but does not last 15k miles. After 8,000 miles I healed my oil levels and it was completely dry. It hasn’t been leaking anywhere because there are never oil spots on the concrete where I park. Good but not great oil.","Reviewed in the United States on August 17, 2018",,
Oil had to be changed at 6K miles.,3.0 out of 5 stars,RJP,"No advantage for my 5.4 F150. Oil looked and smelled bad and had to change.
I have my vehicle serviced often and my ignition system was updated with new plugs and coil packs.
Oil broke down quickly and used more of it than the Motorcraft 5-20 semi synthetic.
I won't buy again.","Reviewed in the United States on May 23, 2017",,
price is so good but everytime when i got the oil,3.0 out of 5 stars,Amazon Customer,"price is so good but everytime when i got the oil...always one of the oil is leaking...i know is shipping problem but i hope next time you guys will pack better, tighter! thats second time leaking...thx!","Reviewed in the United States on January 8, 2018",,
The Good..,3.0 out of 5 stars,Laure Bruner,The Good....superb product. Would not use any other...the bad...post office delivery that left a mess on my porch....should fire the jackwagon who did this.,"Reviewed in the United States on June 8, 2017",https://images-na.ssl-images-amazon.com/images/I/71UT99zOUbL._SY88.jpg,
Good oil,3.0 out of 5 stars,RASHID ali,"Good oil good name , but I see Nissan 0/20 full synthetic better this mobil one i have 36 year experience never buy again go Nissan new lounch 0/20","Reviewed in the United States on October 29, 2017",,
best oil for high milage,3.0 out of 5 stars,Edgar1251,works really good on old engines,"Reviewed in the United States on March 17, 2020",,
Will not last 15K,2.0 out of 5 stars,Fred,"Good oil but hate the false claim of lasting 15k miles. If all you drive is highway miles then it might but i drive 50/50, city, highway, and found metal shaving in the oil when i tried to the 15k interval. I do all of my own oil changes and have never seen metal shaving in my oil before.","Reviewed in the United States on March 16, 2019",,
Two bottles leaked in storage,2.0 out of 5 stars,Doorman,"Oil is fine, but I have had two 5L/gallon bottles leak in storage - what a mess!","Reviewed in the United States on December 19, 2021",,
"Meh, just get the regular stuff",2.0 out of 5 stars,Jack,"My honda civic burns this oil up, by the time my next oil change comes around I've used up another quart, or 25% more oil. I had to check it all the time too because of this. I went back to extended or regular Mobil 1 synthetic and haven't had that problem, never added a drop. I also didn't notice any change in my MPG.","Reviewed in the United States on May 31, 2017",,
The oil is good. The price is not,2.0 out of 5 stars,Michael Reali,The oil is good.  The price is not.  At a leading very large Arkansas-based retailer nearby I get this same product at 60% of this price.  Yay on the product...boo on the price.,"Reviewed in the United States on March 15, 2015",,
This oil is made in China. Not good.,2.0 out of 5 stars,Rob S,Made in CHINA???,"Reviewed in the United States on August 17, 2016",,
"Llegó abierto, saliéndose el aceite.",2.0 out of 5 stars,Franc Perdomo,"
                    The media could not be loaded.
                
 Desgraciadamente el recipiente llegó abierto, botándose el aceite.","Reviewed in the United States on April 20, 2023",,
Oil was opened a quart low,1.0 out of 5 stars,Monua L. Cary,"Note to self, dont order oil from Amazon","Reviewed in the United States on March 3, 2022",,
They don't honor their own rebates.,1.0 out of 5 stars,E. B. Lamberts,"I've stopped using Mobil 1 products.  They are always offering really good rebates, but never seem to get around to paying them.  Fool me once shame on you, fool me twice shame on you.  Never again!","Reviewed in the United States on June 23, 2019",,
MOBIL 1 Ext Perf Oil IS GREAT !!,1.0 out of 5 stars,FloridaWen,"The product is great, I have used MOBIL 1 synthetic oils for over 40 years, never had any problem with orders until this order.  My oil NEVER ARRIVED and the tracking number provided was totally incorrect !!","Reviewed in the United States on April 12, 2019",,
The container is leaking!!!,1.0 out of 5 stars,James L. Wilson,There was oil inside the box.  It turns out it was leaking.,"Reviewed in the United States on July 21, 2021",,
2 of 4 had leak and made a horrible mess in the stairs .,1.0 out of 5 stars,Mehdi,lids are all loose,"Reviewed in the United States on December 8, 2021",,
Oil leaked in the shipping box.,1.0 out of 5 stars,Hermit,"box soaked with oil,leaking outside.","Reviewed in the United States on November 24, 2021",,
Dint expect that from mobile 1,1.0 out of 5 stars,Juan Carlos cibrian,"After 2000Miles the oil was dirty
Amazon synthetic really stayed clean till 4000Miles","Reviewed in the United States on July 9, 2021",,
Received  the oil and it was leaking container damaged.,1.0 out of 5 stars,Dean Anderson,leaking plastic container.,"Reviewed in the United States on January 15, 2022",,
Good productn n,1.0 out of 5 stars,Pinecone,Not sure yet.,"Reviewed in the United States on January 12, 2022",,
Broken merchandise-,1.0 out of 5 stars,Son L.,Broken - oil,"Reviewed in the United States on October 8, 2021",,
Mobile is an excellent product,5.0 out of 5 stars,wastingtime112,"I've used Mobile in my Mercedes for years, I decided to begin using it in my Volvo, it's a very excellent product, protects the engine and is a great value for the money.  You can trust the name and the quality of Mobile products.","Reviewed in the United States on July 20, 2023",,
It works,5.0 out of 5 stars,Kev J,This very good product to use,"Reviewed in the United States on August 9, 2023",,
Oil,5.0 out of 5 stars,kim m glazier,Good oil,"Reviewed in the United States on August 15, 2023",,
Mobil 1,5.0 out of 5 stars,Wayne from Florida,I have used this oil in my vehicles for some time now. I drive my vehicles somewhat hard and this oil performed great. I have not had any oil related failures to engine components and interior of engine remains clean and sludge free.,"Reviewed in the United States on July 19, 2023",,
cheaper than Walmart (if they have it in stock) and Autoparts store.,5.0 out of 5 stars,MLB,For my 2016 Subaru Forester,"Reviewed in the United States on August 11, 2023",,
No need to line up at Walmart,5.0 out of 5 stars,Joelle,It was delivered to my front door for the same price as WMart. With no hazzle of going in line at the register. 5 star.No need to review the product since I only use this for my Prius.,"Reviewed in the United States on July 16, 2023",,
Change it @ 5000 miles.,5.0 out of 5 stars,cindy lewis,"266,000 miles and counting","Reviewed in the United States on July 28, 2023",,
Mobile one high mileage synthetic oil,5.0 out of 5 stars,crackpot,My car is due for an oil change and have used mobile one oil before. Great product,"Reviewed in the United States on July 26, 2023",,
Very good 👍,5.0 out of 5 stars,Yasir Abdalla,I like it,"Reviewed in the United States on August 7, 2023",,
Great Product!,5.0 out of 5 stars,Paul,Great Product!,"Reviewed in the United States on August 13, 2023",,
it works,4.0 out of 5 stars,ralph comegys,very good,"Reviewed in the United States on November 23, 2022",,
Great product.,4.0 out of 5 stars,Bill,"I have used Mobil 1 since it first came out. Great product. Shipping however needs improvement. Order placed August 2nd and finally came today, August 25th..","Reviewed in the United States on August 25, 2022",,
It's hard to be objective about motor oil...,4.0 out of 5 stars,A 21st Century Man,"...when you don't have lab results and/or equipment to prove that it's a good product. All I can say is that I've used Mobil 1 Synthetic for years and change the oil every 5,000 miles; our wheels' (motorcycles and cars) engines perform great (with no oil leaks), so I can't complain.","Reviewed in the United States on May 23, 2022",,
Quality product,4.0 out of 5 stars,Amazon Customer,Works well in my car.  Good price too.,"Reviewed in the United States on October 28, 2022",,
Great Value for M1,4.0 out of 5 stars,Prince Somorin,Mobil1 is the industry standard for value on synthetic oil. This is what th ebook called for on my MY09 Mercedes Benz GL450.,"Reviewed in the United States on August 4, 2022",,
Bought it for its higher levels of Phosphorus/Zinc,4.0 out of 5 stars,S. Greene,"I hove used Mobil 1 in my truck for the last 2-3 years. Prior I had been using their extended 5w-30 
 but this year I wanted to see if it was the best for my truck (old 94 Chevy K1500 w/350 w/over 200k miles). Since my truck has the old TBI 350 with out a roller cam shaft that people say need more ZDP (zinc) in it to protect the camshaft I tried to research what Mobil one had in their offerings (Mobil 1 standard, High mileage and extended). Took a little time as Mobil doesn't list it on their site I was able to find a Mobil 1Oil Product Guide .pdf that lists all their flavors and viscosities with Phosphorus/zinc levels and if it meets any manufacturer requirements. In my case looking at 5W-30 Extended performance had 800ppm Phosphorus and 900ppm zinc, standard Mobil 1 had the same but High Mileage has 1000ppm Phosphorus and 1100ppm Zinc. Off the top of my head I did compare this to what other fully synthetic brands were offering (Valvoline, Penzoil, Castrol), but I am pretty sure this High Mileage was better! (again this is for fully synthetic, you might find matching or better levels in a blend or fully conventional oil)
This is my first go with the stuff so we shall see if it is better?","Reviewed in the United States on December 19, 2015",,
It looks good.,4.0 out of 5 stars,Nhan L.,It works well.,"Reviewed in the United States on October 23, 2022",,
Works great as expected,4.0 out of 5 stars,Amazon Customer,"Was what I needed, same price as store, fast shipping","Reviewed in the United States on September 20, 2022",,
Left in the pouring rain.,4.0 out of 5 stars,THTGRLDIANA,"Product is awesome, thank you!! Amazon delivery however left both packages in the pouring rain. There were no knocks or doorbell rings. Delivery needs to step up their game.","Reviewed in the United States on June 6, 2022",,
Okay,4.0 out of 5 stars,Debby,"Come on oil is oil
what more do you want me to say","Reviewed in the United States on August 19, 2022",,
Oil received not BMW LL-01 approved,3.0 out of 5 stars,Eric G,"Just ordered this for an oil change in a Mercedes and BMW. I know this used to have the BMW LL-01 spec, but the oil I received no longer carried that specification. The jugs I received do not say BMW on the front like in the picture at the top See pic I uploaded. Don't know if Mobil changed there formula, but I'm going to go with Castrol for the BMW.","Reviewed in the United States on December 4, 2017",https://images-na.ssl-images-amazon.com/images/I/611T6Q7RgRL._SY88.jpg,
That there is oil,3.0 out of 5 stars,Zack W,"Man that there’s some oil, but they wouldn’t let me return it when I realized it was going to take 3 weeks to ship and I had already just bought oil at Walmart","Reviewed in the United States on May 21, 2021",,
Nothing but,3.0 out of 5 stars,Seattle Simon,"Hello everyone truck is at 246,XXX and burned through the oil at 5k-6k miles . No different than any high mileage Mobil 1 oil out there","Reviewed in the United States on September 12, 2021",,
"Great oil, though not synthetic at all",3.0 out of 5 stars,Kunal K.,"I use this oil and it works well, am giving it 3 stars because the damn thing is mineral oil and is not synthetic oil. If you want synthetic oil it's packaging must say 100% synthetic oil. I have no complaints on the product just a problem with the misleading labels on the package. These misleading labels are only used in USA and not in Europe. Go figure!!!","Reviewed in the United States on September 6, 2017",,
Switching to Liqui Moly,3.0 out of 5 stars,Yuriy,"If you are a BMW owner, pay attention to specs. I did not realize, but Mobil1 removed LL1 spec from 0W-40 oil. Some containers still list BMW and LL1 spec, but newer ones do not. Also, I recently had to change valve cover gasket on my X3 and was disappointed to see baked on varnish. Always used Mobil1 in this engine. Given I have 100,000 miles on it, I thought it would look better (with BMW recommend oil change intervals). Switching to Liqui Moly.","Reviewed in the United States on April 26, 2016",,
Limited quantity is BS.,3.0 out of 5 stars,Tim ,Good product. Limited amount you can purchase is why I gave 3 stars. I need 50 gallons and could only purchase 4. Big let down.,"Reviewed in the United States on June 11, 2021",,
Known product,3.0 out of 5 stars,Bernardo Apablaza,Is a known product. Good value,"Reviewed in the United States on February 20, 2022",,
Found the Mobil 1 5w30 noisy,3.0 out of 5 stars,Anthony,Found the Mobil 1 5w30 noisy in my 2010 4.0 mountaineer. Ran for 300 miles engine was still  noisy. Drained out and replaced with Quaker state ultimate durability 5w30 and engine was dead quite. Not imagery noisy was real. Retired after 40 years in auto repair. Now this may work fine for you but I will stick with Quaker state ultimate durability 5w30,"Reviewed in the United States on March 30, 2018",,
The oil itself is great quality and works perfect for me,3.0 out of 5 stars,Mitch N.,"The oil itself is great quality and works perfect for me.
But the way Amazon ships it out, with no protection...is a different story. Lots of leaks and had to send it back. A replacement worked great.
So far Amazon stands for return policies, but the overall quality of services and items is greatly impacted...
I guess is the cost of doing business???","Reviewed in the United States on March 3, 2018",,
Average value.,3.0 out of 5 stars,Kelly Warren,Not expensive and not cheap. Not a “deal” but a high quality product. Sometimes I see it on sale at Costco for less $.,"Reviewed in the United States on January 4, 2021",,
Two Stars,2.0 out of 5 stars,Henry Lai,I didn't realize the bottle is so big. It is very difficult to pour it out.,"Reviewed in the United States on December 20, 2017",,
Two Stars,2.0 out of 5 stars,john,"3000 miles oil dark black and thin, get cheaper middle range product just as good","Reviewed in the United States on December 14, 2017",,
Two Stars,2.0 out of 5 stars,Buddy1,Too expensive,"Reviewed in the United States on March 25, 2018",,
Two Stars,2.0 out of 5 stars,Chris Parrott,As expected,"Reviewed in the United States on October 31, 2017",,
Don't think I will buy it from this vendor,2.0 out of 5 stars,Henry C,It was opened.,"Reviewed in the United States on August 14, 2017",,
Two Stars,2.0 out of 5 stars,HV,One of bottle is leaked.  It's a mess.,"Reviewed in the United States on June 16, 2016",,
