title,rating,username,description,date,image_urls,asin_number
This is great quality engine oil,5.0 out of 5 stars,John,"Mobile one motor all is one of the top engine oils on the market you just never want to run an engine more than 5000 miles without changing the oil regardless if it says 20,000 miles without changing annoyed because I don't get dirty and dirty oil causes friction in the motor, dirty pistons, and eventually scarring on the piston cylinders.  If you're reading this review, please change your oil every 5000 miles the engine will love you for it and will last you a whole lot longer. I have a Chevy 2002 and I've been running this motor oil in my engine for the past 21 years never had a problem because I always change my motor oil every 5000 miles.","Reviewed in the United States on August 8, 2023",,
Only oil for Mercedes-Benz,5.0 out of 5 stars,Jacqueline Lystrup,"I buy two of these 5 quart jugs for every oil change I do in my Mercedes-Benz AMG's.  Each one takes 9 quarts per oil change and this is easily the least expensive way to get that quantity.  I have an E63S AMG as well as an ML63 and this oil I will ever use.  I have seen some 5 quart oil advertised that appears to be the same thing but it came in a bag inside the box instead of giving you a plastic jug.  This will be a 5qt jug which is far better for giving you an empty jug to fill with a cap to take to your nearest oil recycling place after your oil change is finished.  Make sure never to mix synthetic oil with standard though.  If you have a BMW, Audi, Mercedes-Benz, Volkswagen, Porsche, etc that's a European make, this is definitely the oil you're looking for.","Reviewed in the United States on July 10, 2023",,
If it's good enough for Ferrari it's good enough for mama's Toyota!,5.0 out of 5 stars,Westerns Forever,"'Been using AMSOIL for over 40 years.. Mobil 1 was never a full synthetic.. But that's changed.. Times have changed..  Engines these days run for hundreds of thousands of miles.. Synthetic oils have been a large contributor to this longevity.. Amsoil's always been hard to find.. Amazon sells Mobil 1, which is now a Full Synthetic.. And I'm old and on a fixed income.. Mobil 1 wins!","Reviewed in the United States on August 11, 2023",,
Mobil 1 Extended Performance High Mileage Full Synthetic Motor Oil 5W-30,4.0 out of 5 stars,steve,"only gave 4 stars as I have never used this one -
I have been using Mobile One Full Synthetic for my cars and trucks
standard Full Synthetic & High Mileage versions
for a long time now and Always happy with them
Noticed this one (Extended Performance) and thought why not check it out
Is it just be a relabel of the standard High Mileage bottle ?? don't know
Either way, I have always been happy with Mobile One products","Reviewed in the United States on August 17, 2023",,
Good oil,5.0 out of 5 stars,Derrick,"Good oil,  always recommend Mobil 1, I have seen ProjectFarm and FordTechMakuloco on youtube about Mobile 1 and it is a superior product.  I use in all my vehicles including my rarely driven hauler truck which I only change 1-2 times a year.  I also use this product in my newer F150 which asks for 10k intervals, I drive this truck 1500-1800miles/mon and I change every 5k but knowing that I'm changing it ""mid life"" or going over a bit, gives me peace of mind.  I use it in my wife 2020 vehicle which is used very lightly and changed every 10k.  It fits all my vehicle needs.","Reviewed in the United States on July 16, 2023",,
Over 360000 miles,5.0 out of 5 stars,William Eddy ll,I started using Mobile 1 extended on my then new 2011 chevy impala on its first oil change and I use a fram10000 mile oil filter. I add half a quart is all to my car at 5000 miles other cars may need more between oil changes. Then I change the oil and filter every 10000 miles. I now have 365000 miles on my original factory engine with no oil burning either! Mobil 1 fully synthetic oil is a great product!,"Reviewed in the United States on August 4, 2023",,
Actually good for 20K plus miles,5.0 out of 5 stars,Luis Martinez,"First used this at 160K miles on my Lexus GX 460. Changed it at 180K and the oil was still full and color was somewhat clear. Could’ve probably done another 5K with oil, but for sure good for 20K at least.","Reviewed in the United States on August 11, 2023",,
Truly Epic Oil,5.0 out of 5 stars,Controlled Chaos,"This is epic oil, really. It improves gas mileage overall and withstands extremely demanding environments.
In changing it it always is cleaner than most and still has the characteristics of good oil unlike others which appear thined out or like sludge.
I trust it because after using GTX for years on vehicles hitting 300,000 miles, that says it all.
Great stuff, get it.","Reviewed in the United States on August 1, 2023",,
Perfect for Mercedes GLC43 AMG,5.0 out of 5 stars,Bolts&Banter,"DIY guy here doing maintenance on my 2018 Mercedes GLC43 AMG. This ships fast and the pricing is competitive, saving me a trip to the store.","Reviewed in the United States on August 18, 2023",,
I use it often,5.0 out of 5 stars,Family Man,My higher mileage vehicles actually all vehicles use synthetic as of 6 years ago. I take excellent care of them and feel confident in mobile one. I feel the higher mileage additives help engines run better for the long haul. Recently I noticed the price in subscribe and save are priced fair. Every 5000 miles oil and filter. I recycle the old oil and it's accepted at local auto parts store.,"Reviewed in the United States on July 24, 2023",,
Oil is great. Shipping practices are the WORST.,1.0 out of 5 stars,JohnnyRocket,"Was going to change my oil until i saw the cap on the bottle had cracked and distributed oil from one Stae to the next. Bottle was 1/2 full and the mess was as you can imagine it would be. Amazon does not accept messy returns so basically your stuck with the partial bottle of expensive non-returnable crap. It's a great price but only if you get it, right?","Reviewed in the United States on May 31, 2022",,
Watch out😱😱,1.0 out of 5 stars,CARLOS EDUARDO MEDRANO ,"I've been following up for 2 months and this oil is evaporating... I don't know the reason, but I don't know, I already checked the mechanics and the PCV valve is new, the understanding of each cylinder is good and the intake and exhaust valves work very well the car has good power","Reviewed in the United States on August 30, 2022",,
"88 for a 5 quart jug is a great price, but not so great for a outdated ...",1.0 out of 5 stars,GypsyDanger,"Buyer beware. At $23.88 for a 5 quart jug is a great price, but not so great for a outdated product. Mobile One is excellent oil, and as a professional automotive technician I highly recommend this oil for your car. The oil I ordered had a API service grade of SL, which was not stated clearly in the discription. A SL grade is for use in 2004 and older vehicles only. If your vehicle is 2005 or newer be sure you get an oil with a rating of SN to be sure your engine is protected. And of course all quality petroleum manufactures of oil, including Mobile One, produce these advanced lubricants.","Reviewed in the United States on July 30, 2015",,
Not really 5 quarts,1.0 out of 5 stars,steveinmd,Been using advanced fuel economy 0w20 for years. Switched to extended due to supply chain issues and both bottles I ordered were at least .75 quart low. I have reached out to Mobil 1 and they have yet to respond. YMMV,"Reviewed in the United States on November 8, 2022",,
"Not the right oil which is shown here, they do the bait and switch.",1.0 out of 5 stars,Jc Denton,"Not extended performance.  Sold me high mileage, which is not what has been advertised here.  Why can't these sellers get a single order correct, seems like they just can't get anything right.  Two orders in a row are wrong.","Reviewed in the United States on September 5, 2022",,
Arrived open,1.0 out of 5 stars,Bought this thing,Product arrived opened and missing some oil.,"Reviewed in the United States on April 22, 2023",,
it does not fit. it is tiny,1.0 out of 5 stars,Rachel,"useless, tiny not good does not fit","Reviewed in the United States on April 19, 2023",,
Great for Audi,1.0 out of 5 stars,helpful 4 u,Product came leaking from the top,"Reviewed in the United States on April 4, 2023",,
"Containers leak, bad thread seal and loose foil seal.",1.0 out of 5 stars,Shaunagain,"Terrible Packaging, poor container design. The box had oil-saturation due to the 5 qt container leaking. Top was not screwed tightly, however upon checking found that the top will endlessly run without engaging tightly. Below the threaded lid is a foil seal - which is sealed loosly - allowing oil to spill. I'm sure the oil is a good product however the container is entirely inadequate and allows spillage during shipping. In addition packaging was minimal which also allowed the container to be bumped around probably causing more spill issues. Not only bad packaging but an environmental threat. Fix this Mobil one, ever container is a mini Exxon Valdez polluting with leaking oil.","Reviewed in the United States on March 28, 2016",,
Very good oil,1.0 out of 5 stars,jim black,Good product,"Reviewed in the United States on April 11, 2023",,
It’s oily,5.0 out of 5 stars,Peepeenello,And slippery,"Reviewed in the United States on July 13, 2023",,
Best price,5.0 out of 5 stars,Lucas,I’ve been buying my oil for my 2011 Toyota Camry here for years.,"Reviewed in the United States on July 2, 2023",,
Used in my Ford Powerstroke Diesel.,5.0 out of 5 stars,Michael Broglin,"I have been using this oil for years now and have had great success with it. No problems with my injectors like other have had, and this was the best price I found for it.","Reviewed in the United States on June 26, 2023",,
Good oil,5.0 out of 5 stars,Justin,"What can I say? I’ve ran this oil in my 01 GMC Sierra most of its life. It has 345k miles on it now and still going strong. Is it because of the synthetic oil?…I do believe so. I also change the oil every 5k miles(I know that’s overkill). Oil is cheap compared to a new motor. Just buy this oil, you can’t go wrong with it.","Reviewed in the United States on June 11, 2023",,
It works well,5.0 out of 5 stars,Dawny,Oil was changed on my Honda Odyssey.  It has been working well so far. Good deal.,"Reviewed in the United States on July 3, 2023",,
good value,5.0 out of 5 stars,apple pie,motorcycle oil.  great value,"Reviewed in the United States on July 13, 2023",,
best around,5.0 out of 5 stars,Amazon Customer,great oil for a turbo,"Reviewed in the United States on July 20, 2023",,
Perfect,5.0 out of 5 stars,Ivan Corral,"Cheapest than the stores, well packaged, I’m satisfied with my purchase. I will buy with the same seller on my next service. Recommended.","Reviewed in the United States on July 4, 2023",,
Best engine oil so far,5.0 out of 5 stars,LeoL,"I got 2020 rav4 hybrid. I drove my car around 8000 miles a year and I change the engine oil same time every summer. This mobile 1 engine oil is perfect for my need which has guaranteed to 10,000 miles a year. The auto store will charge $75 with oil change, this can save you half price if DIY. Highly recommend!","Reviewed in the United States on June 12, 2023",,
Great quality,5.0 out of 5 stars,Salgadö,Got this cause it was on special. Honestly you can't go wrong with Mobil. We definitely recommend.,"Reviewed in the United States on July 4, 2023",,
"Delivery to long, expensive",4.0 out of 5 stars,Rohm L.,"Like product, dislike price","Reviewed in the United States on August 22, 2021",,
Absolutely the lowest price.,4.0 out of 5 stars,johnfcon,"Figure the price at the ""oil change place"", or the discount price at the big chain auto parts store. No, I don't like changing my oil, so the kid next door does it when he comes over to mow the lawn. Lawn, every week. Mobile 1? Once a year, because I don't even get 6-7k on the clock in a year.","Reviewed in the United States on September 25, 2017",,
"The oil still looks good, although over 15",4.0 out of 5 stars,Justin Webb,"I've used Mobile 1 exclusively in my 2013 ford focus changing the oil when the light comes on. At 70,000 miles I switched to the Extended Performance blend as I put a lot of miles on and am looking forward to extending the drains. Just about to do the first change at 85,000 miles. The oil still looks good, although over 15,000 miles I did have to top off a total of a quart.","Reviewed in the United States on May 22, 2016",,
I try to take as much care for my car as possible and I feel like my car runs the best on this oil,4.0 out of 5 stars,Amazon_addict,The only oil I use for my 2014 Elantra. I try to take as much care for my car as possible and I feel like my car runs the best on this oil. I have tired other oils which I find my car to run louder than when I use this oil. I will continue to use this oil for my present and future cars.,"Reviewed in the United States on January 10, 2017",,
4 star,4.0 out of 5 stars,Bibliofan S,"Very good Synthetic Oil, good prices","Reviewed in the United States on June 19, 2021",,
Synthetic at a bargain,4.0 out of 5 stars,Nozama MaMa,Great value for synthetic,"Reviewed in the United States on July 31, 2021",,
Good Product,4.0 out of 5 stars,Amazon Customer,Use this oil in two of my vehicles along with Mobil 1 oil filters. I drive each of these vehicles between 7K & 8K miles per year and change the oil annually. I'm confident from reviews and reports on these products that they are as good as any I'm likely to find. I've not had any problems so far.,"Reviewed in the United States on March 7, 2017",,
"Amazon Prime...good price, free shipping......",4.0 out of 5 stars,gmsky,"This is good oil. and I got it for less than 23$ each. Have a Saturn Sky and a Buick that like it. Amazon Prime price and free shipping, so I have no idea how ""regular retail"" auto parts stores survive now........well I guess they have to make it only due to emergent issues people have.","Reviewed in the United States on October 11, 2017",,
Not sure I'm getting 5 quarts in a 5 quart ...,4.0 out of 5 stars,Jo,"Not sure I'm getting 5 quarts in a 5 quart jug.  I didn't check but, my Honda CR-V requires 4.4 quarts including the filter.  I used the whole 5 quart jug and was still half a quart low.  ???  I will check to see how much is in a 5 quart jug next time.","Reviewed in the United States on September 15, 2017",,
The oil it the best,4.0 out of 5 stars,cheomary25,Good motor oil,"Reviewed in the United States on July 14, 2021",,
One Star,1.0 out of 5 stars,Mr. Mslm,Don't buy this product  because it is too expensive,"Reviewed in the United States on October 3, 2015",,
FAKE OIL,1.0 out of 5 stars,David Chatterton,This is not genuine Mobil Synthetic.,"Reviewed in the United States on March 29, 2023",,
One Star,1.0 out of 5 stars,thu,Im not see why,"Reviewed in the United States on November 11, 2016",,
seller didnt prepare product correctly.,1.0 out of 5 stars,James Willett,was leaking when arrived,"Reviewed in the United States on July 29, 2015",,
All 2019-2022Toyota RAV4 call for 0w16 oils,1.0 out of 5 stars,steven w greeson,"All newer Toyota RAV4 and many other models of Toyota automobiles only allow the use of 0w16 motor oils!  They claim if it can’t be found we can only use 0w20 for emergency purposes, and to change it back to 0w16 as soon as possible!  This could void your warranty!  Wish you made a 0w16 full synthetic!","Reviewed in the United States on February 14, 2022",,
DOESN’T COME WITH FILTER,1.0 out of 5 stars,Ivan F.,"It doesn’t make sense, why wouldn’t it come with the filter already?? Buy it at an autozone better.","Reviewed in the United States on June 1, 2022",,
Synthetic,1.0 out of 5 stars,bee,"Two weeks ago I seen this for $22 and change, when I wanted to buy it it jumped up to $42 so of course I did not buy it, buyers beware when you put something on the wish list you can bank on a price increase, this happened many times to me, also I understand that this oil is not a real Synthetic oil, it's made from CRUDE oil...","Reviewed in the United States on October 5, 2021",,
Prices,1.0 out of 5 stars,minh triet ngo,the oil is great however the cost is costly. It's $27 in walmart,"Reviewed in the United States on February 18, 2022",,
Burns too easily,1.0 out of 5 stars,Yumi Wolf,Would give this zero stars if I could. This oil burns too much and I had to change it at 1000 miles because it was so dirty. I paired this with Mobil 1 extended performance filter. My regular change interval is 3750 miles. Not worth your money. I have had a better experience with Castrol synthetic.,"Reviewed in the United States on July 30, 2020",,
Does NOT ship to Mexico,1.0 out of 5 stars,vacation,Does NOT ship to Mexico,"Reviewed in the United States on March 11, 2022",,
Best over the counter oil on the market,5.0 out of 5 stars,jeff turlington,I've always used this brand of oil to protect all my vehicles needs.,"Reviewed in the United States on July 16, 2023",,
Ultimate Choice for High-Mileage Engines,5.0 out of 5 stars,Nazar Nasirzada,"I purchased Mobil 1 Advanced Full Synthetic Motor Oil 5W-30 in May 2022, and it has been about 6,200 miles since my last oil change. I must say that I am highly satisfied with this product.
As my car has 99,000 miles on it, I wanted an oil that could provide my high-mileage engine with superior protection, and Mobil 1 Advanced Full Synthetic Motor Oil has definitely delivered. The oil comes in a 5-quart container, which is perfect for a single oil change, and it is extremely easy to pour.
One of the best things about this oil is its longevity. Despite the 6,200 miles on the oil, it still looks clean and has not broken down, which is a testament to its superior quality. This means that I can go longer between oil changes, which is not only convenient but also saves me money in the long run. If you have a high-mileage engine and are looking for superior performance and protection, I highly recommend this oil.","Reviewed in the United States on April 19, 2023",,
Excllent oil for Toyota CHR.,5.0 out of 5 stars,Imran Khan,I started to change my own oil after the dealerhip oil would turn blck quickly. This oil does not change color and best for cold starts and cool tempreatures. Has been preforming awesome. Best fuel mileage ever.,"Reviewed in the United States on July 3, 2023",,
Great oil,5.0 out of 5 stars,E Lipkovitch,Great oil at a great price !,"Reviewed in the United States on July 11, 2023",,
Great 👍 oil,5.0 out of 5 stars,Peter,Always reliable,"Reviewed in the United States on July 15, 2023",,
good price.,5.0 out of 5 stars,Amazon Customer,The best.,"Reviewed in the United States on July 12, 2023",,
It's oil,5.0 out of 5 stars,Jay,Definitely oil.,"Reviewed in the United States on July 18, 2023",,
Great price,5.0 out of 5 stars,Farmboy402005,Works great,"Reviewed in the United States on July 12, 2023",,
Great product,5.0 out of 5 stars,Orlando Rodriguez,Great product,"Reviewed in the United States on July 21, 2023",,
Excelente precio,5.0 out of 5 stars,Amazon Customer,Buena calidad,"Reviewed in the United States on July 12, 2023",,
Been using Mobil 1 for decades; now on my 'Vette GS.  Very happy with results.,4.0 out of 5 stars,futbolref,"I've been using Mobil 1 since it was first marketed.  I've never had a single oil-related issue with any of the multiple cars I've used it on.  It's great for turbochargers where it completely eliminates any coking issues.  The German car purists say it doesn't meet German 'standards' but I think what it doesn't do is meet the German OEM's fantastic profit margins.  I've used it on numerous BMWs, my son on Audis.  Very satisfied with the entire Mobil 1 line.","Reviewed in the United States on May 3, 2016",,
"Mobil 1 120764 Synthetic Motor Oil 5W-30, 5 Quart",4.0 out of 5 stars,Joe Biker,"I use full synthetic motor oil for it's improved flow @ low temps (compared to conventional oil) as well as it's resistance to breaking down @ higher temps...have even gone 4-5K miles on it, when I usually change conventional oil @ 3K miles..
shop for best price on this, sometimes it's on Amazon, sometimes found locally for less.","Reviewed in the United States on March 19, 2019",,
Its good oil,4.0 out of 5 stars,James Keller,To much money,"Reviewed in the United States on December 21, 2021",,
Great,4.0 out of 5 stars,Jess C,Good stuff,"Reviewed in the United States on January 3, 2022",,
But I can't prove it works better than any other conventional or synthetic oil,4.0 out of 5 stars,Glen W,I have been using Mobil 1 and other synthetic oils for 25 plus years. But I can't prove it works better than any other conventional or synthetic oil.  I do feel it's a good idea to use it and it gives me piece of mind. I really can't say it performs better or worse.  So it's not an easy thing to rate accurately.,"Reviewed in the United States on December 28, 2017",,
Testing,4.0 out of 5 stars,Michael Elmlinger,"I like the concept of synthetic oil but for me the jury is still out. After much research into the pros and cons of synthetic oil I thought I'd give it a try in my 2004 Jeep Grand Cherokee with 75,000 miles. Even though I bought a 10,000 mile filter I'm planning on changing the oil at 6,000 miles. I don't want to push it on the first go at it.","Reviewed in the United States on June 12, 2017",,
Most of my clients depend on it .,4.0 out of 5 stars,Tarek,Longer lasting use,"Reviewed in the United States on October 30, 2021",,
Good price compared to local stores.,4.0 out of 5 stars,anniemary,What's not to like.  Oil is oil!,"Reviewed in the United States on July 1, 2021",,
No No No,4.0 out of 5 stars,liveinatree,"Product is ok, but not happy with the Sbscription Program. Price for first time is great, but when it is time for the next shipment the price goes up, Higher than what I can get a similar product at Walmart. I thought the convenience would be great, but not when the prices go up. I had read reviews that said the same thing. I tried the program, but will not use,glad iread the price s for the next order. I  have cancelled my subscriptions.","Reviewed in the United States on September 5, 2014",,
... far as oil goes Mobil1 is one of the best. I gave 4 stars because for the viscosity ...,4.0 out of 5 stars,Jessie James,As far as oil goes Mobil1 is one of the best. I gave 4 stars because for the viscosity my car needs I don't really have many choices so this is what I have to buy. The price was fair but I have found that I can find it on sale at the auto parts store and spend less than on Amazon.,"Reviewed in the United States on September 9, 2017",,
One Star,1.0 out of 5 stars,Amazon Customer,We’re good engine oil but I receive damaged package.,"Reviewed in the United States on December 27, 2017",https://images-na.ssl-images-amazon.com/images/I/71UWs9qfGDL._SY88.jpg,
WASTE,1.0 out of 5 stars,gixxer,"FEELS CHEAP, END FELL APART ALREADY. WASTE OFMONEY","Reviewed in the United States on October 10, 2017",,
One Star,1.0 out of 5 stars,HB,"arrived with a cracked edge, clunky at the bottom.","Reviewed in the United States on November 9, 2017",,
Recommend Quaker State 'Defy' as a much better alternative,1.0 out of 5 stars,Curt,Company cares nothing for the environment!  Recommend Quaker State 'Defy' as a much better alternative!,"Reviewed in the United States on July 18, 2016",,
Cheaper elsewhere,1.0 out of 5 stars,Happy Mama to 9,"This is the only oil I use, I should have checked competitors price before I bought it, much cheaper.","Reviewed in the United States on November 29, 2014",,
One Star,1.0 out of 5 stars,Has,Not good. Very bad.,"Reviewed in the United States on March 17, 2018",,
late,1.0 out of 5 stars,bruce m.,Was delivered 2 days late. Nothing wrong with the product,"Reviewed in the United States on March 29, 2017",,
One Star,1.0 out of 5 stars,kevin,Never got my oils and never buy this again.,"Reviewed in the United States on June 10, 2016",,
One Star,1.0 out of 5 stars,supportBALK,open tape,"Reviewed in the United States on October 2, 2017",,
Joke,1.0 out of 5 stars,Matthew,"Everyone needs to understand that here in the U.S any oil company can use class 3 oil and claim full synthetic. People believe mobil 1 is the best oil out there because its sold everywhere but in fact its always 3rd to dead last on 3rd party testing. If you truly want a 100% synthetic then you want Amsoil! This stuff is just alittle harder to find just order from a dealer or order online. Everyone uses base stock oil but its the additives they use that makes oil extremely good. Dont ever take anyone's word including myself, just get online and search oil testing. Then you will understand and see who makes the best synthetic oil out there. Im only on here looking for a 5qt until i get my order from amsoil. Just reading what people say makes me laugh and upset because i hate people who lie! Do your research and make the right choices when it comes to the best oil on the market.. hope these helps people..","Reviewed in the United States on February 4, 2022",,
Its motor oil,5.0 out of 5 stars,Tauan De Almeida,Engine is still running,"Reviewed in the United States on August 4, 2023",,
Mobile 1,5.0 out of 5 stars,Larry,Love this oil.,"Reviewed in the United States on August 4, 2023",,
Oil,5.0 out of 5 stars,Rebecca Sanchez,Exactly what I ordered,"Reviewed in the United States on July 19, 2023",,
