title,rating,username,description,date,image_urls,asin_number
The extended synthetic is almost a secret now,5.0 out of 5 stars,Mr Buy from Amz,"It's harder to find the extended 20k full synthetic, all the oils locally and the majority sold online are 10K rated. This means that the level of oil they're using is of lower quality but still passes for full synthetic tag. There are even lower grade full synthetics now that are even cheaper and I do believe they are decent for most but if you want the best in protection for whatever reason, extended performance full synthetic has the best protection because of the higher grade synthetics used.
Stock up!","Reviewed in the United States on June 6, 2023",,
Good oil,5.0 out of 5 stars,Jose Choy,Like it good oil,"Reviewed in the United States on July 20, 2023",,
Aceite Mobil,5.0 out of 5 stars,Amazon Customer,Ése aceite es de mejor calidad que otros probados anteriormente por el uso del vehículo lo cambio cada 3500 km y ése es de los pocos aceites que me funciona,"Reviewed in the United States on July 4, 2023",,
Motor oil,5.0 out of 5 stars,Kd,"Very good price on Mobil one 0/16, motor oil.","Reviewed in the United States on July 18, 2023",,
Mobil 1,5.0 out of 5 stars,M&J,love this oil,"Reviewed in the United States on July 24, 2023",,
It’s oil.,5.0 out of 5 stars,Amazon Customer,It’s all oil. Put this in our 50k mile jaguar fpace. Worked fine,"Reviewed in the United States on July 6, 2023",,
Some of the best oil,5.0 out of 5 stars,Mike,"I use this everytime I do an oil change, it works like it says","Reviewed in the United States on July 3, 2023",,
Nice Motor Oil,4.0 out of 5 stars,HikingInSierras,Nice motor oil.  Use on my E46 BMW 3-Series.,"Reviewed in the United States on March 27, 2022",,
"""extended"" life oil",4.0 out of 5 stars,James,"For me I generally like to lean towards the side of caution and change my oil when the sensor kicks and tells me to change it on the HUD.  Ran this oil in 5W-20 with a K&N high performance filter and it lasted about 3200 miles and 4 months before I got the oil change message. Pros:
easy starts always
didn't really burn any oil
Cons: didn't last 15000 miles as advertised
*I could have just reset the oil sensor and ran the full 15000 miles but like I said I like to be cautious when it comes to vehicular maintenance.","Reviewed in the United States on August 9, 2016",,
"Not BMW LL01 Approved Anymore, But Still Great Oil.",4.0 out of 5 stars,Phelan Trinh,"I always use Mobile 1, but just a note for those BMW owners that care; Amazon is stocking the newest formulation which isn't BMW LL01 approved anymore. Personally, I don't mind (lots of factors that us auto guys all don't need to go into), but just thought everyone should know. I heard that this is still the OEM stuff they use for Audi, Mercedes and Porsche. You can probably find the BMW approved stuff as old stock somewhere (look for BMW on the front as a listed manufacturer).","Reviewed in the United States on December 30, 2017",,
Recommend.,4.0 out of 5 stars,Amayzun,Great product.  Recommended.,"Reviewed in the United States on February 22, 2022",,
I THINK it is pretty good,4.0 out of 5 stars,BWH,"After checking online, researching forums, and asking mechanics, I decided on Mobile 1 for my Subaru. I've been quite satisfied with it, but could not legitimately say whether it has provided more benefit to my car's engine than another brand of oil could. It is impossible for me to quantify its effectiveness, so I can only rate it 4 stars based on the fact that though I've never had any issues with it and my car seems to be running well with it, I'm just not sure whether it is in fact better than lower cost alternatives.","Reviewed in the United States on September 4, 2016",,
Good For my 1991 Toyota Corolla WGN. 4AFE Engine.,4.0 out of 5 stars,Bruce S.,Available when I had a hard time finding elsewhere.,"Reviewed in the United States on January 5, 2022",,
Good,4.0 out of 5 stars,angel,Good value,"Reviewed in the United States on February 20, 2022",,
"OK, but won't but anymore.",4.0 out of 5 stars,H J S,"Kept the engine lubricated for a year.  Our plug in hybrid tells us when to change the oil, but it never has.  We change it once a year anyway, and only 1/3 of the mileage on the car has been with the gasoline engine.  The other 2/3 has been on battery electric.  But, I have switched to another brand from now on after looking over comparison charts of different synthetic oils.","Reviewed in the United States on April 16, 2018",,
Good oil and a great price,4.0 out of 5 stars,butter123,"Decent standard motor oil for European cars. If you do not live up in the north, I would recommend going with a 5w-40 grade oil instead. For normal daily driving, this oil would be fine for manufacture change intervals and at this price, you could save a lot money.
Comparing this to the 5w-40 formula M 229.5 in a m272 engine, the formula m runs a bit quitter and probably have more additives, however it's also double the price.
For some reason, BMW unapproved this oil.","Reviewed in the United States on January 19, 2017",,
Great value,4.0 out of 5 stars,Geoffrey Hashimoto,Good pricing and free shipping for Prime members.  Hard to beat for value.,"Reviewed in the United States on October 17, 2021",,
I used to buy and I like it very much,3.0 out of 5 stars,Eddie Ionni,"I used to buy and I like it very much. I would give 5 stars but .....Don't Buy from Amazon for ""$49"". Walmart is selling $26 for 1 5 quart.","Reviewed in the United States on December 31, 2014",,
"Meh! There are MUCH better options out there for more or less money, but this price sucks!",3.0 out of 5 stars,Seth Elwyn Burgin,"Mediocre for synthetic oil, if not on the low quality end of the spectrum. Price is ridiculously high, so Amazon Prime is on my list of things to get rid of.","Reviewed in the United States on April 18, 2018",,
Great oil but missing one important approval for me,3.0 out of 5 stars,JC19454,"Great oil but missing one important approval for me, LL-01 for my BMW.  They used to be approved so literature and photos deceiving since they just lost it,  New stock not approved.  Old stock approved.","Reviewed in the United States on June 1, 2016",,
For Prime members only??? I can get it at Walmart for $22.88,3.0 out of 5 stars,GoJo Dingo,For Prime members only??? I can get it at Walmart for $22.88,"Reviewed in the United States on October 5, 2017",,
Three Stars,3.0 out of 5 stars,Crystal Tse,Can I use in my hyundai 2014 accent hack back with this oil,"Reviewed in the United States on August 1, 2017",,
Same quality as many other synthetic brands.,3.0 out of 5 stars,Cutteo,I can't tell from any other synthetic brand.,"Reviewed in the United States on December 22, 2016",,
Works in a pinch; castrol edge is superior,3.0 out of 5 stars,Andy,"Synthetic, does the job and doesn't anger VWoA. Makes the lifters noisy in my mkVI GTI. Castrol Edge 0W-40 is much preferred","Reviewed in the United States on November 23, 2014",,
A little pricey when i brought it,3.0 out of 5 stars,joonie,"Overall is ok … i brought it when the price is the highest, should wait a little bit","Reviewed in the United States on March 25, 2022",,
Mmm,3.0 out of 5 stars,Israel,Se sigue probando pero va bien,"Reviewed in Mexico on August 8, 2023",,
Calidad precio el mejor,3.0 out of 5 stars,Juan J.,"Es para Ford econoline van 2003
Lo uso desde hace 5 ańos buen produco.","Reviewed in Mexico on October 4, 2022",,
One Star,1.0 out of 5 stars,MikeymikeGTR,"The sealed cap was missing, so who knows what oil was in the container. Returned","Reviewed in the United States on April 26, 2018",,
No good,1.0 out of 5 stars,Omar,No good,"Reviewed in the United States on November 18, 2019",,
One Star,1.0 out of 5 stars,G.Girouard,Product came with a small hole in it and oïl leaked on all my order.,"Reviewed in the United States on February 6, 2018",,
LEAKING OILS,1.0 out of 5 stars,Sofia,Product arrived broken and the oil was leaking. I want a refund of one of the oils.,"Reviewed in the United States on January 12, 2018","https://images-na.ssl-images-amazon.com/images/I/518WmPjX-0L._SY88.jpg
https://images-na.ssl-images-amazon.com/images/I/51VcfFLY2+L._SY88.jpg",
"Not Mobils fault, I bought the wrong weight, ...",1.0 out of 5 stars,Joseph Sheffield,"Not Mobils fault, I bought the wrong weight, cant use it.
Didn't realize it til some time later when I got ready to change the oil.","Reviewed in the United States on June 7, 2016",,
One Star,1.0 out of 5 stars,aaron Merrill,2 day shipping took TWELVE days! and then it arrived and is leaking EVERYWHERE!!!!,"Reviewed in the United States on August 18, 2017",,
Pay close attention to price,1.0 out of 5 stars,Amazon Customer,Didn’t notice price but from now on I will . One quart $27.00,"Reviewed in the United States on October 26, 2017",,
Don’t buy,1.0 out of 5 stars,Phoenix,Where were leaking in the box when I received them,"Reviewed in the United States on October 22, 2017",,
"The Oil Container Was Leaking, Which Ruined The Shipping ...",1.0 out of 5 stars,Brian ,"The Oil Container Was Leaking , Which Ruined The Shipping Box. Not Sure About Buying Any More !!","Reviewed in the United States on January 31, 2017",,
Leaking oil,1.0 out of 5 stars,Sam,Half of oil have  been leaking.,"Reviewed in the United States on November 18, 2017",https://images-na.ssl-images-amazon.com/images/I/61tAs3pi+8L._SY88.jpg,
Good product,5.0 out of 5 stars,BigT,Good seller and fast delivery,"Reviewed in the United States on July 31, 2023",,
Perfect for us DIYers!,5.0 out of 5 stars,Les in Nipomo,I found considerable savings buying my oil this way! It was packaged well and arrived safe and sound without any issues at all! The perfect quantity for an oil and filter change too.,"Reviewed in the United States on July 10, 2023",,
price and quality.,5.0 out of 5 stars,WD Smith,"I have used Mobil oil products for decades with no problems, from our personal vehicles to my class 8 trucks. Its highly rated.","Reviewed in the United States on July 19, 2023",,
Great,5.0 out of 5 stars,Rick,"Great product, price & delivery","Reviewed in the United States on July 24, 2023",,
Go's the distance,5.0 out of 5 stars,Keith P,I've been using this oil for many years and it keeps motors running longer than the cars will last. Great oil!,"Reviewed in the United States on July 15, 2023",,
Best of the kind,5.0 out of 5 stars,Anton,Sold my acura with 215k miles on it and only alive part of it was a motor. 100k of every day abuse in nyc. Floored it every time. Change oil every 3k.,"Reviewed in the United States on July 8, 2023",,
special order,5.0 out of 5 stars,Omar Dominguez,this was a special order for a customer. Came in pretty quick and customer was satisfied.,"Reviewed in the United States on July 26, 2023",,
Excellent value for synthetic oil,5.0 out of 5 stars,Rob Rock,Perfect for my motorcycle,"Reviewed in the United States on August 4, 2023",,
Great quality oil at a fantastic price,5.0 out of 5 stars,Michael W. Lamb,Quick delivery and cheaper than the same oil at Walmart!,"Reviewed in the United States on August 3, 2023",,
Good quality oil,5.0 out of 5 stars,Charles R.,Used this for years in all my toyotas. Good stuff.,"Reviewed in the United States on July 26, 2023",,
Don't unload box in the dark,4.0 out of 5 stars,J. C.,"It's oil.  Reason I get it from Amazon is because it is a little cheaper than the local big box and the local stores are always out of this type.  I got six jugs this time (long commute) and they broke the order into 5+1 due to hazmat rules, no biggie.  I am writing this review as a word of warning that the box that had the 5 jugs in it had 1 jug with a pin-size hole leak in it, I am assuming from the warehouse since the safety bag in the box did not leak at all (+1 for backup plan).  I arrived home after dark and decided to unload the box into my garage before going in the house.  I could not see into the box and just grabbed 2 jugs and went.  Going back for more is when I realized I had a leak.  Looking down I noticed a hand-size oil mark on my slacks. Moral of the story, don't unload oil in your good clothes.","Reviewed in the United States on November 21, 2015",https://images-na.ssl-images-amazon.com/images/I/71fWjKHL8mL._SY88.jpg,
#1,4.0 out of 5 stars,R  fisher,"Fast and on time. Obviously everybody knows mobile one synthetic is number one. I buy the 10,000 mile guaranteed synthetic because I change it every 7500 so the other oil was a waste of money if you were going to leave oil in your car for 15,000 miles, I don’t think it’s good","Reviewed in the United States on July 11, 2021",,
Thumps up,4.0 out of 5 stars,Ibraham,Thumps up,"Reviewed in the United States on July 3, 2022",,
"Good Oil, Good Price",4.0 out of 5 stars,yootzee,"I'm not an oil / lube geek.  But, from the numbers and reviews I've seen, Mobil 1 syn is good quality, especially for the price point.  $25 is about right, and is about what my local Walmart is carrying it for as well.  I usually pick it up from there vs. online.  However, they've started reducing stock on filters, and filter brands and no longer carry what I like for my cars (Wix).  So, when I saw it here for the same price, just got everything I needed for all my cars here at one time.  I was a little worried about leakage as the condition of many of the boxes I receive from Amazon look like they've been drop-kicked the back of the truck.  But, everything came in okay.","Reviewed in the United States on February 24, 2018",,
Excellent Value,4.0 out of 5 stars,DeeJay SKY,very convenient for me instead of running around looking for this synthetic fluid for my SUV,"Reviewed in the United States on March 23, 2022",,
good for,4.0 out of 5 stars,Simyan,good,"Reviewed in the United States on May 24, 2022",,
Mobil1 makes good oil,4.0 out of 5 stars,A.B.,I’ve always used Mobil1 synthetic oil and never been disappointed. I will continue to use it in my Toyota Tundra and help keep that workhorse running nicely.,"Reviewed in the United States on November 30, 2021",,
Get what you pay for..,4.0 out of 5 stars,Country Boy,I trust this stuff. Pricey up front. Hope the mileage estimates are accurate. Be sure to buy a top quality filter though!,"Reviewed in the United States on January 13, 2022",,
I only put Mobile 1,4.0 out of 5 stars,Noe,Would have put 5 stars but package was delayed a few days. But arrived and happy.,"Reviewed in the United States on February 16, 2022",,
Favorable price.,4.0 out of 5 stars,Abby,"The price of this product is very favorable, and the express delivery speed is also fast.  I am very satisfied.  But I think its packaging needs to be improved to make it safer during transportation.","Reviewed in the United States on June 30, 2021",,
Three Stars,3.0 out of 5 stars,Leanne jones,Could of been packaged better.  Bottle was leaking when arrived.,"Reviewed in the United States on August 15, 2016",,
Three Stars,3.0 out of 5 stars,Public name,"Cheaper at Walmart, no complaints otherwise","Reviewed in the United States on January 19, 2017",,
Three Stars,3.0 out of 5 stars,Amazon Customer,good,"Reviewed in the United States on May 28, 2017",,
Three Stars,3.0 out of 5 stars,Diana J.,"I received a different grade, order 0W-40 received 10W-30","Reviewed in the United States on December 20, 2015",,
Not impressed.,3.0 out of 5 stars,CuRoi,I am not really impressed. Didnt really help.,"Reviewed in the United States on January 9, 2016",,
The rebate still waiting to come,3.0 out of 5 stars,raymondmwong,I love it.but I still waiting for the rebate.,"Reviewed in the United States on July 7, 2015",,
Three Stars,3.0 out of 5 stars,aterveen_1487,Ty,"Reviewed in the United States on January 22, 2016",,
Benz C250 2013 - will have to reconsider,3.0 out of 5 stars,Dionisio L Yang,"Updated review:  I didn't switch to save $$, I switched thinking 0w40 full synthetic must be better than 5w40 OEM benz oil which is only a blend.  I might have to give this another chance in the future.  I thought it burned faster than the OEM oil, but I discovered that result was flawed since it ended up being another problem that burned the oil.
However, still not too happy about how fast the oil got dark compared to the OEM oil.","Reviewed in the United States on March 18, 2022",,
Not the Best,3.0 out of 5 stars,"Einstein, WV","This is a good synthetic oil but in tests done it has the lowest temperature rating of all the synthetics tested, which means it gets hot fast. The number one oil and the one I have used for years is Amsoil. It has the highest temperature rating and I can go 8-10 thousand miles between changes. I know one mechanic who uses it and just takes the filter off mid year and empties it and fills it with clean Amsoil. Then at the end of the year he changes the oil and filter. So far no problems. It costs a lot more but you know what they say ""you get what you pay for"". I don't always go by this but in this case I wholeheartedly agree. Saves a lot of time and your engine.","Reviewed in the United States on November 18, 2017",,
"Try Castrol Magnate, its Amazing.",3.0 out of 5 stars,ROBERT,"Well, After first 45 K miles I start putting this oil and Always thinking the Best, Never can't get rid of the Valve tic on my Car. All this time Paying so much for nothing Until I bough Castro Magnate Synthetic oil; WOW. My car Sound so Nice and Smooth and the Tic tac noise from valves is GONE
----  Now I buy only Castrol Magnate Synthetic 5w20 or 5w30; Its Amazing what it Did in my Car.
-----  65 K Miles putting Mobil one to my Car for Nothing with so High Prices .
THIS IS NOT AN ADVERTISEMENT AGAINST MOBIL ONE, ITS MY EXPERIENCE . IT DOESN'T IMPRESE ME Mobil one","Reviewed in the United States on June 16, 2018",,
"oil is good stuff, but i used to order it through ...",1.0 out of 5 stars,Tony Ellis,"oil is good stuff, but i used to order it through here for about $25.  It appears in the last few months it jumped to $40.  no thanks, i'll buy else where.","Reviewed in the United States on June 5, 2016",,
"short one quart of oil, I had to go ...",1.0 out of 5 stars,johnny dash,"short one quart of oil, I had to go out and buy another quart of oil for my Sonata 2011.","Reviewed in the United States on April 27, 2018",,
FRAUD,1.0 out of 5 stars,Gregory Doran,There were 4.3 Quarts of oil in this 5 quart container & appears the cap was tampered with.,"Reviewed in the United States on November 18, 2017","https://images-na.ssl-images-amazon.com/images/I/718D1fTzX8L._SY88.jpg
https://images-na.ssl-images-amazon.com/images/I/81H9bDaVAGL._SY88.jpg",
Mobil didn't honor rebate,1.0 out of 5 stars,Sunny,Mobil didn't honor their rebate for oil purchased at Amazon.,"Reviewed in the United States on June 5, 2019",,
"Awful shipping, great product.",1.0 out of 5 stars,Aaron L. Sliski,"Great product but took 2+ weeks to show up at my door, when it said prime..... there is no better oil than this","Reviewed in the United States on July 17, 2017",,
Leaks,1.0 out of 5 stars,Sarah,Leaking upon arrival,"Reviewed in the United States on February 25, 2020",,
Mobil 1 changed formula which fails to meet BMW specifications ...,1.0 out of 5 stars,Pokey,Mobil 1 changed formula which fails to meet BMW specifications. I actually returned five gallons due to the misleading graphic,"Reviewed in the United States on August 31, 2016",,
Buyer Beware,1.0 out of 5 stars,ergo,"When I went to use the product, I found the seal had been ""neatly"" replaced under the cap  and approximately one quart of oil had been used from the container. Beware.","Reviewed in the United States on February 21, 2016",,
"Why Bother With Reviews, Amazon deletes the truth when it hurts.",1.0 out of 5 stars,Ex_AMAZON-CUSTOMER_Started2009_ENDED_2017.RIP.ROUND3,"Why Bother With Reviews, Amazon deletes the truth when it hurts.","Reviewed in the United States on February 11, 2017",,
"Loose Cap, Big Mess!",1.0 out of 5 stars,Jarvis Sheridan,A cap was loose on one of the oil bottles. Just a small amount of oil leaked out but it created a large mess.,"Reviewed in the United States on June 2, 2016",,
"It's Mobil synthetic oil,",5.0 out of 5 stars,Amazon Customer,What's there to say?  it didn't leak in shipping I guess.,"Reviewed in the United States on July 20, 2023",,
Only oil I use and will always use,5.0 out of 5 stars,Omar Zain,Amazing performance…….,"Reviewed in the United States on August 5, 2023",,
Good product,5.0 out of 5 stars,frank,I use mobile 1 oil all the time. Never had any problem,"Reviewed in the United States on August 2, 2023",,
Number 1,5.0 out of 5 stars,Falah Aljaf,"Always with mobile 1 specially this 0w30 is very good for my car ,I did change oil and filter every 6000 mile instead of 10000 that make me fell not worry about my engine.","Reviewed in the United States on July 10, 2023",,
Impressive N/A-Engine performance!,5.0 out of 5 stars,MikesDuneRunnerSLS,"(I've only used this Mobil 1 OW-30 AFE in naturally aspirated vehicles) This oil has been a true proven performer for me! Has great heat protection! It's been a particularly good replacement for the 0W-20 Toyota oil spec on my 5th Gen 4Runner. I like this 30 weight protection because it's setup to climb sand dunes. Climbing dunes all day builds a lot of heat! Even as a 30 weight the engine is very quiet like it should be on cold engine startup. In my opinion, this is the best passenger car motor oil Mobil 1 makes.","Reviewed in the United States on June 5, 2023",,
Good price,5.0 out of 5 stars,good quality,"nice price, and on time delivery. never have issue with their product","Reviewed in the United States on July 22, 2023",,
Quiet happy engine,5.0 out of 5 stars,Brad,It makes the Mercedes i4 m274 engine way more quiet and smoother vs the genuine oil and castrol oils,"Reviewed in the United States on July 22, 2023",,
as advertised,5.0 out of 5 stars,e.chow,good price just enough for my Toyota Rav oil change of 4.8 quarts,"Reviewed in the United States on July 22, 2023",,
Full synthetic,5.0 out of 5 stars,James Chandler,Working well,"Reviewed in the United States on July 25, 2023",,
Mobil 1 🛢,5.0 out of 5 stars,Big Slim,"It's hard to know if something is really working if while it's working you can't see it. / while I'm driving I can't see in the Engine, in other words......  but going by results only -  I've been using Mobil 1 oil in my car for years with no issues . I change my oil & filter once a year on time .  Mobil 1 Oil allows you to like your mechanic,  but from a far distance!  Pay now 💰  or Pay later 💵 .","Reviewed in the United States on June 17, 2023",,
Easy to use.,4.0 out of 5 stars,dan mancillas,Good Value.,"Reviewed in the United States on August 25, 2022",,
It's Mobil One a trusted source,4.0 out of 5 stars,Billgon,"The key to long trouble free engine life is frequent oil changes with a top quality oil (5000 miles max). This is a full synthetic oil and should perform well. I have a 2011 GMC Terrain with 200,500 miles and have not had any issues with using this oil and trust the Mobil Brand.","Reviewed in the United States on September 28, 2021",,
Product arrived on date promised.,4.0 out of 5 stars,EDDIE STEVENS,The box that the oil came in was pretty damaged but the product itself was undamaged.,"Reviewed in the United States on May 14, 2022",,
Over all good,4.0 out of 5 stars,Afzal Ghumman,Over all good,"Reviewed in the United States on August 9, 2022",,
Good product,4.0 out of 5 stars,Christopher Walcott,What i like about this product is the full synthetic of this motor oil. I use it in my high mileage engine,"Reviewed in the United States on March 1, 2022",,
thank you...,4.0 out of 5 stars,yong kun,thank you...,"Reviewed in the United States on August 6, 2022",,
2nd to royal purple,4.0 out of 5 stars,Scott H.,"Not as good as royal purple,  but is a bit cheaper","Reviewed in the United States on May 15, 2022",,
good,4.0 out of 5 stars,jerzy narzynski,very happy,"Reviewed in the United States on July 18, 2022",,
"It's not 100 percent synthetic,from what I have learned.",4.0 out of 5 stars,Tim f.,"It says full synthetic,but I have learned it's not,100percent  synthetic.100 percent will cost twice as much.its their play on words that tend to deceive you.","Reviewed in the United States on February 2, 2022",,
Heard that it was great reviews,4.0 out of 5 stars,Amazon Customer,I heard great reviews about the product!,"Reviewed in the United States on June 4, 2022",,
Not made to keep you going.,3.0 out of 5 stars,Mobe,It lasts only around 2000 miles.,"Reviewed in the United States on December 21, 2019",,
Cheaper at Walmart,3.0 out of 5 stars,Ben,Love this oil however you can get this significantly cheaper at Walmart 25$,"Reviewed in the United States on November 25, 2018",,
Three Stars,3.0 out of 5 stars,HONG HUYNH,"WHY PEOPLE BUY MB1 , BECAUSE ALL THEY KNOW IS THE NAME MB1","Reviewed in the United States on June 16, 2018",,
"Hey, what do you expect.... ...",3.0 out of 5 stars,PoppaV,"Hey, what do you expect..... it's motor oil.  It's not gonna save a broken engine, but it will keep it from breaking.","Reviewed in the United States on October 7, 2016",,
Medium product,3.0 out of 5 stars,Asghar,Not too bad,"Reviewed in the United States on June 19, 2023",,
Don't use in cold weather with a Mini Cooper.,3.0 out of 5 stars,Mark,Doesn't work in cold weather with my Mini Cooper.,"Reviewed in the United States on February 3, 2018",,
Good but prefer Valvoline,3.0 out of 5 stars,B Town,Ok motor oil. Switched back to valvoline and like that better.,"Reviewed in the United States on August 18, 2017",,
Three Stars,3.0 out of 5 stars,jery,"Great product, lower price at Sam's Club for 6 quart pack for $37.40","Reviewed in the United States on February 8, 2017",,
