title,rating,username,description,date,image_urls,asin_number
As designed,5.0 out of 5 stars,JCW,"Do you have a Honda product that recommends this oil? Then buy it already. It's what Honda recommends, and it's hard to find a cheaper, better alternative.","Reviewed in the United States on August 3, 2023",,
The best factory oil,5.0 out of 5 stars,John Horsley,Works as intended. Replaced my oil at 9100 miles on bike and it drives smooth and shifts like a new bike.,"Reviewed in the United States on August 2, 2023",https://m.media-amazon.com/images/I/91j46iGkC3L._SY88.jpg,
It’s oil,5.0 out of 5 stars,Christian lupton,Doesn’t taste to good,"Reviewed in the United States on August 15, 2023",,
good oil,5.0 out of 5 stars,oldman,got for sxs 520,"Reviewed in the United States on August 13, 2023",,
"GREAT SERVICE, FAST SHIPPER, ALL GOOD",5.0 out of 5 stars,Ryan A,"Thank you for fast shipping, order received in good order.","Reviewed in the United States on August 9, 2023",,
The big difference,5.0 out of 5 stars,Reza Ghodousi,Great and authentic product and big difference between Honda engine oil for it’s own product and products that have the same specifications. The Honda engine oil specifically designed for Honda engine.,"Reviewed in the United States on July 13, 2023",,
The product was quick to arrive,5.0 out of 5 stars,Kate,The product was recommended for a Honda side by side,"Reviewed in the United States on July 24, 2023",,
Honda Motorcycle Oil,4.0 out of 5 stars,MikeP,Very good quality oil. Arrived in reasonable amount of time and very reasonable price for Honda oil,"Reviewed in the United States on July 7, 2023",,
Great,5.0 out of 5 stars,Billy Jones,Great,"Reviewed in the United States on July 9, 2023",,
Excelente,5.0 out of 5 stars,Alexander Abreu,Funciona de maravilla,"Reviewed in the United States on July 5, 2023",,
