title,rating,username,description,date,image_urls,asin_number
The correct type of oil your vehicle requires,5.0 out of 5 stars,Anthony Ramsey,"These days everything is 3 times the price that only a few years ago was our norm. Decent price for the merchandise, and they have the oil that's hard to find","Reviewed in the United States on August 14, 2023",,
Good oil!,5.0 out of 5 stars,Nathan Douglas,My boat seems to like it just fine!,"Reviewed in the United States on August 11, 2023",,
Best for high mileage,5.0 out of 5 stars,ThinAir,"Have always used Castrol for my high mileage vehicles. Always performs great with no issues as long as you maintain your car correctly, of course.","Reviewed in the United States on July 30, 2023",,
Cumplió mis expectativas,5.0 out of 5 stars,Abimael Silva ,Excelente producto,"Reviewed in the United States on July 30, 2023",,
Gastrolito,4.0 out of 5 stars,Leonardo Guedez,Buen producto,"Reviewed in the United States on July 10, 2023",,
Best Synthetic Oil!,5.0 out of 5 stars,"Big ""C""",I use nothing other than Castrol Synthetic oil in all my gas engines including my cars. I have a Volvo and they specifically recommend using Castrol Synthetic. I wouldn't use anything else.,"Reviewed in the United States on May 17, 2023",,
Right stuff!,5.0 out of 5 stars,Darren C. Hampton,Great value for the money,"Reviewed in the United States on May 21, 2023",,
Excellent oil,5.0 out of 5 stars,Michael Lowe,"Been using the High Mileage 10w 30 since May 2022. My car had 76,000 miles at that time. Had switched from a valvoline synthetic blend. As time progressed, the car just felt smoother and smoother, as if it healed. Fuel consumption got better, I assume because the engine felt as if it worked less to give power. This oil works great. I get around 8,000 to 8,500 miles from a bottle, depending on how I drive. Wish the price was cheaper, mainly because to ship this oil to my country ""Guyana"", the total cost runs me $84 USD (freight, shipping, duty etc.).","Reviewed in the United States on January 20, 2023",,
Oil,5.0 out of 5 stars,Melesio R.,All good the services and the oil,"Reviewed in the United States on May 4, 2023",,
it fit great,5.0 out of 5 stars,Gloria,good deal,"Reviewed in the United States on April 26, 2023",,
